num_,num,clave_,clave,titulo,ubicacion,latitud,longitud,URL,autor,permiso,autor_ig,media_ig,multimedia_sound,multimedia_video,multimedia_video_id,multimedia_tiktok_user,multimedia_tiktok_id,narracion
04_1,1,04_l_callejon_diablo,l_callejon_diablo,El Callejón del Diablo,Centro de la ciudad de Campeche,19.84406,-90.53128,https://diademuertos.uxmalsoft.com/?cvegeo=04&l=l_callejon_diablo,Gabriela O. Vega Eraña,SI,@theunexpectedg,@midnightstrike_mx,,,,,,"Se cuenta que hasta hace poco tiempo existía, cerca de lo que ahora es el centro de la ciudad de Campeche, un callejón conocido como el “Callejón del Diablo”. La vereda iba desde el descampado de San Martín hasta la Zanja y estaba envuelto por frondosos árboles. Se dice que al final del sombrío pasillo se encontraba una vieja casona en la que habitaba un enfermo de tuberculosis. 

No se sabe con exactitud si era debido al enfermo, el nombre que tenía o su aspecto lúgubre pero era un hecho que muy poca gente se aventuraba a transitar por esa ruta y quien lo hacía la recorría a paso apresurado. 

Pese a esto y sin ninguna explicación el lugar empezó a cobrar gran fama con los más jóvenes, era el sitio perfecto para probar su valor. Las reglas eran simples solo debían cruzarlo de noche, utilizando solo sus sentidos, y si sobrevivían el trayecto eran considerados parte del grupo. Eso solo si lograban vencer la oscuridad que parecía tragarse hasta tu alma.

En cierta ocasión, uno de aquellos valientes volvía a casa luego de una reunión con sus amigos la cuál terminó ya muy noche, se internó sin miedo en el callejón y cuando ya iba casi a mitad de camino logró ver una figura que se apoyaba en el tronco de uno de los mencionados árboles. Él joven se sobresaltó pero pronto se recuperó y pensando que seguro era alguno de los novatos que lo querían asustar se dirigió a paso firme al individuo. Cuando ya se encontraba a unos pocos metros un rayo de luna inesperado iluminó la escena y ante los ojos del joven, un ser horrendo con cara desfigurada se reía desquiciado, el muchacho no tuvo tiempo de pensar, los vellos de su piel se erizaron y su sentido de conservación lo hicieron correr con todas sus fuerzas, evitando tal vez un fatídico destino. 

La noticia no se hizo esperar de que en el callejón aparecía el diablo encarnado y a consecuencia de ese incidente, ya nadie osaba ni por equivocación cruzar ese camino al caer la noche. 

La comunidad espantada y con la intención de que no cayera alguna maldición sobre ellos, comenzaron a dejar ofrendas bajo aquel árbol infernal, de preferencia joyas y monedas de oro. Lo curioso es que todos aquellos supersticiosos que dejaban sus obsequios aseguraban que las ofrendas del día anterior desaparecían, lo que les confirmaba que efectivamente el diablo se encontraba feliz con ellos. 

Un  día el misterio llegó a oídos de dos pescadores que ya habían visto de todo en alta mar por lo que no le tenían miedo a nada, concordaron que todo el asunto era muy extraño y de seguro se trataba de una farsa.
Al filo de la medianoche, dos siluetas fornidas penetraron la vereda y como era de esperarse la figura del presunto diablo se encontraba apoyada en el árbol. Listo para infundir terror a aquellos que osaron ingresar a sus dominios, el padre de las tinieblas se vio sorprendido por algo que no esperaba, a la luz de una antorcha nacida de la nada, vio emerger la imagen de un ser peludo, con cuernos y larga cola, el verdadero satanás, aún sin reponerse de la sorpresa inicial sintió como una mordedura en las posaderas le quemaba las entrañas y aunque no era más que un tizón al rojo vivo que le acababa de aplicar uno de los pescadores, a nuestro diablo se le fue el alma al suelo y solo atino a gritar —¡Jesús, el diablo quiere llevarme!—; y, emitiendo aullidos demoníacos, emprendió una carrera, comparada con la de los juegos olímpicos.
A la noche siguiente, los pescadores montaron guardia hasta el alba, pero el diablo no apareció y al poco tiempo, se descubrió que un prominente personaje de la comunidad había llegado al hospital con largas y graves quemaduras en sus nalgas. El individuo sanó porque según la opinión pública se arrepintió de sus culpas y donó una larga cantidad de joyas y monedas de oro a la caridad, entre las cuales muchos creyeron  reconocer las ofrendas que había hecho al diablo.
"
